{
  "schemaVersion": "0.0.0",
  "entry": "index.html",
  "publicPath": "/",
  "externals": {},
  "server": {
    "proxy": [
      {
        "url": "/api",
        "target": "http://localhost:3000/api?a=1&b=1",
        "pathRewrite": [
          {
            "regular": "^/api",
            "replacement": ""
          }
        ]
      }
    ]
  }
}
